{
  "commandType": "ProposeAiChange",
  "workspaceId": "11111111-1111-4111-8111-111111111111",
  "correlationId": "aaaaaaaa-aaaa-4aaa-8aaa-aaaaaaaaaaaa",
  "idempotencyKey": "ai-propose-1",
  "payload": {
    "action": "SUGGEST_FIELDS",
    "selection": {
      "objectIds": ["bbbbbbbb-bbbb-4bbb-8bbb-bbbbbbbbbbbb"]
    },
    "instruction": "补齐必填字段"
  }
}
